{"date":"2026-02-05","form":"ordinary","calendar":"united-states","season":{"code":"ordinary-time","name":{"en":"Ordinary Time","es":"Tiempo Ordinario","pt-BR":"Tempo Comum"},"week":4},"celebration":{"title":{"en":"Saint Agatha, virgin and martyr","es":"Santa Águeda, virgen y mártir","pt-BR":"Santa Águeda, virgem e mártir"},"rank":{"code":"memorial","name":{"en":"Memorial","es":"Memoria","pt-BR":"Memória"}},"color":"red"},"alternatives":[],"status":null,"readings":[{"id":"first-reading","citation":"1 Kings 2:1-4, 10-12"},{"id":"responsorial-psalm","citation":"1 Chronicles 29:10, 11ab, 11d-12a, 12bcd"},{"id":"gospel","citation":"Mark 6:7-13"}]}