{"date":"2027-04-15","form":"1962","calendar":"united-states","season":{"code":"easter","name":{"en":"Paschaltide","es":"Tiempo Pascual","pt-BR":"Tempo Pascal"},"week":null},"celebration":{"title":{"en":"Feria of the 3rd Week of Easter","es":"Feria de la 3.ª semana de Pascua","pt-BR":"Féria da 3ª semana da Páscoa"},"rank":{"code":"class-4","name":{"en":"Feria of the IV Class","es":"Feria de IV clase","pt-BR":"Féria de IV classe"}},"color":"white"},"alternatives":[],"status":null,"readings":[{"id":"epistle","citation":"1 Peter 2:21-25","passages":[{"book":"1-peter","startChapter":2,"startVerse":21,"endChapter":2,"endVerse":25}]},{"id":"gospel","citation":"John 10:11-16","passages":[{"book":"john","startChapter":10,"startVerse":11,"endChapter":10,"endVerse":16}]}]}