{"date":"2027-05-23","form":"ordinary","calendar":"mexico","season":{"code":"ordinary-time","name":{"en":"Ordinary Time","es":"Tiempo Ordinario","pt-BR":"Tempo Comum"},"week":8},"celebration":{"title":{"en":"The Most Holy Trinity","es":"La Santísima Trinidad","pt-BR":"Santíssima Trindade"},"rank":{"code":"solemnity","name":{"en":"Solemnity","es":"Solemnidad","pt-BR":"Solenidade"}},"color":"white"},"alternatives":[],"status":null,"readings":[{"id":"first-reading","citation":"Deut 4:32-34, 39-40"},{"id":"responsorial-psalm","citation":"Ps 33:4-5, 6, 9, 18-19, 20, 22"},{"id":"second-reading","citation":"Rom 8:14-17"},{"id":"gospel","citation":"Matt 28:16-20"}]}