{"date":"2027-08-19","form":"ordinary","calendar":"united-states","season":{"code":"ordinary-time","name":{"en":"Ordinary Time","es":"Tiempo Ordinario","pt-BR":"Tempo Comum"},"week":20},"celebration":{"title":{"en":"Thursday of the Twentieth Week in Ordinary Time","es":"Jueves de la 20.ª semana del Tiempo Ordinario","pt-BR":"Quinta-feira da 20ª semana do Tempo Comum"},"rank":{"code":"weekday","name":{"en":"Weekday","es":"Feria","pt-BR":"Féria"}},"color":"green"},"alternatives":[{"title":{"en":"Saint John Eudes, priest","es":"San Juan Eudes, presbítero","pt-BR":"São João Eudes, presbítero"},"rank":{"code":"optional-memorial","name":{"en":"Optional Memorial","es":"Memoria libre","pt-BR":"Memória facultativa"}},"color":"white"}],"status":null,"readings":[{"id":"first-reading","citation":"Judg 11:29-39a"},{"id":"responsorial-psalm","citation":"Ps 40:5, 7-8a, 8b-9, 10"},{"id":"gospel","citation":"Matt 22:1-14"}]}