{"date":"2026-11-04","form":"ordinary","calendar":"mexico","season":{"code":"ordinary-time","name":{"en":"Ordinary Time","es":"Tiempo Ordinario","pt-BR":"Tempo Comum"},"week":31},"celebration":{"title":{"en":"Saint Charles Borromeo, bishop","es":"San Carlos Borromeo, obispo","pt-BR":"São Carlos Borromeu, bispo"},"rank":{"code":"memorial","name":{"en":"Memorial","es":"Memoria","pt-BR":"Memória"}},"color":"white"},"alternatives":[],"status":null,"readings":[{"id":"first-reading","citation":"Phiippians 2:12-18"},{"id":"responsorial-psalm","citation":"Ps 27:1, 4, 13-14"},{"id":"gospel","citation":"Luke 14:25-33"}]}