{"date":"2027-06-03","form":"1962","calendar":"general-roman","season":{"code":"after-pentecost","name":{"en":"Season after Pentecost","es":"Tiempo después de Pentecostés","pt-BR":"Tempo depois de Pentecostes"},"week":null},"celebration":{"title":{"en":"Feria of the 2nd Week After Pentecost","es":"Feria de la 2.ª semana después de Pentecostés","pt-BR":"Féria da 2ª semana depois de Pentecostes"},"rank":{"code":"class-4","name":{"en":"Feria of the IV Class","es":"Feria de IV clase","pt-BR":"Féria de IV classe"}},"color":"green"},"alternatives":[],"status":null,"readings":[{"id":"epistle","citation":"1 John 3:13-18","passages":[{"book":"1-john","startChapter":3,"startVerse":13,"endChapter":3,"endVerse":18}]},{"id":"gospel","citation":"Luke 14:16-24","passages":[{"book":"luke","startChapter":14,"startVerse":16,"endChapter":14,"endVerse":24}]}]}