{"date":"2026-04-19","form":"ordinary","calendar":"brazil","season":{"code":"easter","name":{"en":"Easter Time","es":"Tiempo Pascual","pt-BR":"Tempo Pascal"},"week":3},"celebration":{"title":{"en":"Third Sunday of Easter","es":"III Domingo de Pascua","pt-BR":"Domingo III da Páscoa"},"rank":{"code":"sunday","name":{"en":"Sunday","es":"Domingo","pt-BR":"Domingo"}},"color":"white"},"alternatives":[],"status":null,"readings":[{"id":"first-reading","citation":"Acts 2:14, 22-33"},{"id":"responsorial-psalm","citation":"Ps 16:1-2, 5, 7-8, 9-10, 11"},{"id":"second-reading","citation":"1 Pet 1:17-21"},{"id":"gospel","citation":"Luke 24:13-35"}]}