{"date":"2027-08-04","form":"1962","calendar":"mexico","season":{"code":"after-pentecost","name":{"en":"Season after Pentecost","es":"Tiempo después de Pentecostés","pt-BR":"Tempo depois de Pentecostes"},"week":null},"celebration":{"title":{"en":"St. Dominic, Confessor","es":"Santo Domingo, confesor","pt-BR":"São Domingos, confessor"},"rank":{"code":"class-3","name":{"en":"Feast of the III Class","es":"Fiesta de III clase","pt-BR":"Festa de III classe"}},"color":"white"},"alternatives":[{"title":{"en":"Feria of the 11th Week After Pentecost","es":"Feria de la 11.ª semana después de Pentecostés","pt-BR":"Féria da 11ª semana depois de Pentecostes"},"rank":{"code":"commemoration","name":{"en":"Commemoration","es":"Conmemoración","pt-BR":"Comemoração"}},"color":null}],"status":null,"readings":[{"id":"epistle","citation":"2 Timothy 4:1-8","passages":[{"book":"2-timothy","startChapter":4,"startVerse":1,"endChapter":4,"endVerse":8}]},{"id":"gospel","citation":"Luke 12:35-40","passages":[{"book":"luke","startChapter":12,"startVerse":35,"endChapter":12,"endVerse":40}]}]}