{"date":"2027-10-11","form":"ordinary","calendar":"general-roman","season":{"code":"ordinary-time","name":{"en":"Ordinary Time","es":"Tiempo Ordinario","pt-BR":"Tempo Comum"},"week":28},"celebration":{"title":{"en":"Monday of the Twenty-eighth Week in Ordinary Time","es":"Lunes de la 28.ª semana del Tiempo Ordinario","pt-BR":"Segunda-feira da 28ª semana do Tempo Comum"},"rank":{"code":"weekday","name":{"en":"Weekday","es":"Feria","pt-BR":"Féria"}},"color":"green"},"alternatives":[{"title":{"en":"Saint John XXIII, pope","es":"San Juan XXIII, papa","pt-BR":"São João XXIII, papa"},"rank":{"code":"optional-memorial","name":{"en":"Optional Memorial","es":"Memoria libre","pt-BR":"Memória facultativa"}},"color":"white"}],"status":null,"readings":[{"id":"first-reading","citation":"Rom 1:1-7"},{"id":"responsorial-psalm","citation":"Ps 98:1bcde, 2-3ab, 3cd-4"},{"id":"gospel","citation":"Luke 11:29-32"}]}