{"date":"2027-04-03","form":"1962","calendar":"mexico","season":{"code":"easter","name":{"en":"Paschaltide","es":"Tiempo Pascual","pt-BR":"Tempo Pascal"},"week":null},"celebration":{"title":{"en":"Saturday within the Octave of Easter","es":"Sábado de la octava de Pascua","pt-BR":"Sábado na oitava da Páscoa"},"rank":{"code":"class-1","name":{"en":"Day within the Octave of the I Class","es":"Día de la octava de I clase","pt-BR":"Dia na oitava de I classe"}},"color":"white"},"alternatives":[],"status":null,"readings":[{"id":"epistle","citation":"1 Peter 2:1-10","passages":[{"book":"1-peter","startChapter":2,"startVerse":1,"endChapter":2,"endVerse":10}]},{"id":"gospel","citation":"John 20:1-9","passages":[{"book":"john","startChapter":20,"startVerse":1,"endChapter":20,"endVerse":9}]}]}