{"date":"2026-02-24","form":"1962","calendar":"united-states","season":{"code":"lent","name":{"en":"Lent","es":"Cuaresma","pt-BR":"Quaresma"},"week":null},"celebration":{"title":{"en":"St. Matthias, Apostle","es":"San Matías, apóstol","pt-BR":"São Matias, apóstolo"},"rank":{"code":"class-2","name":{"en":"Feast of the II Class","es":"Fiesta de II clase","pt-BR":"Festa de II classe"}},"color":"red"},"alternatives":[{"title":{"en":"Tuesday of the 1st Week of Lent","es":"Martes de la 1.ª semana de Cuaresma","pt-BR":"Terça-feira da 1ª semana da Quaresma"},"rank":{"code":"commemoration","name":{"en":"Commemoration","es":"Conmemoración","pt-BR":"Comemoração"}},"color":null}],"status":null,"readings":[{"id":"epistle","citation":"Acts 1:15-26","passages":[{"book":"acts","startChapter":1,"startVerse":15,"endChapter":1,"endVerse":26}]},{"id":"gospel","citation":"Matthew 11:25-30","passages":[{"book":"matthew","startChapter":11,"startVerse":25,"endChapter":11,"endVerse":30}]}]}