{"date":"2027-09-30","form":"1962","calendar":"brazil","season":{"code":"after-pentecost","name":{"en":"Season after Pentecost","es":"Tiempo después de Pentecostés","pt-BR":"Tempo depois de Pentecostes"},"week":null},"celebration":{"title":{"en":"St. Jerome, Priest, Confessor, Doctor","es":"San Jerónimo, sacerdote, confesor y doctor","pt-BR":"São Jerônimo, sacerdote, confessor e doutor"},"rank":{"code":"class-3","name":{"en":"Feast of the III Class","es":"Fiesta de III clase","pt-BR":"Festa de III classe"}},"color":"white"},"alternatives":[{"title":{"en":"Feria of the 19th Week After Pentecost","es":"Feria de la 19.ª semana después de Pentecostés","pt-BR":"Féria da 19ª semana depois de Pentecostes"},"rank":{"code":"commemoration","name":{"en":"Commemoration","es":"Conmemoración","pt-BR":"Comemoração"}},"color":null}],"status":null,"readings":[{"id":"epistle","citation":"2 Timothy 4:1-8","passages":[{"book":"2-timothy","startChapter":4,"startVerse":1,"endChapter":4,"endVerse":8}]},{"id":"gospel","citation":"Matthew 5:13-19","passages":[{"book":"matthew","startChapter":5,"startVerse":13,"endChapter":5,"endVerse":19}]}]}