{"date":"2027-10-07","form":"ordinary","calendar":"general-roman","season":{"code":"ordinary-time","name":{"en":"Ordinary Time","es":"Tiempo Ordinario","pt-BR":"Tempo Comum"},"week":27},"celebration":{"title":{"en":"Our Lady of the Rosary","es":"Nuestra Señora del Rosario","pt-BR":"Nossa Senhora do Rosário"},"rank":{"code":"memorial","name":{"en":"Memorial","es":"Memoria","pt-BR":"Memória"}},"color":"white"},"alternatives":[],"status":null,"readings":[{"id":"first-reading","citation":"Malachi 3:13-20b"},{"id":"responsorial-psalm","citation":"Ps 1:1-2, 3, 4, 6"},{"id":"gospel","citation":"Luke 11:5-13"}]}