{"date":"2027-08-15","form":"1962","calendar":"united-states","season":{"code":"after-pentecost","name":{"en":"Season after Pentecost","es":"Tiempo después de Pentecostés","pt-BR":"Tempo depois de Pentecostes"},"week":null},"celebration":{"title":{"en":"The Assumption of Our Lady","es":"Asunción de la Santísima Virgen María","pt-BR":"Assunção da Bem-aventurada Virgem Maria"},"rank":{"code":"class-1","name":{"en":"Feast of the I Class","es":"Fiesta de I clase","pt-BR":"Festa de I classe"}},"color":"white"},"alternatives":[{"title":{"en":"XIII Sunday after Pentecost","es":"XIII domingo después de Pentecostés","pt-BR":"XIII Domingo depois de Pentecostes"},"rank":{"code":"commemoration","name":{"en":"Commemoration","es":"Conmemoración","pt-BR":"Comemoração"}},"color":null}],"status":null,"readings":[{"id":"epistle","citation":"Judith 13:22-25; 15:10","passages":[{"book":"judith","startChapter":13,"startVerse":22,"endChapter":13,"endVerse":25},{"book":"judith","startChapter":15,"startVerse":10,"endChapter":15,"endVerse":10}]},{"id":"gospel","citation":"Luke 1:41-50","passages":[{"book":"luke","startChapter":1,"startVerse":41,"endChapter":1,"endVerse":50}]}]}