{"date":"2027-05-10","form":"ordinary","calendar":"general-roman","season":{"code":"easter","name":{"en":"Easter Time","es":"Tiempo Pascual","pt-BR":"Tempo Pascal"},"week":7},"celebration":{"title":{"en":"Monday of the Seventh Week of Easter","es":"Lunes de la VII Semana de Pascua","pt-BR":"Segunda-feira da Semana VII da Páscoa"},"rank":{"code":"weekday","name":{"en":"Weekday","es":"Feria","pt-BR":"Féria"}},"color":"white"},"alternatives":[{"title":{"en":"Saint John of Avila, priest and doctor of the Church","es":"San Juan de Ávila, presbítero y doctor de la Iglesia","pt-BR":"São João de Ávila, presbítero e doutor da Igreja"},"rank":{"code":"optional-memorial","name":{"en":"Optional Memorial","es":"Memoria libre","pt-BR":"Memória facultativa"}},"color":"white"}],"status":null,"readings":[{"id":"first-reading","citation":"Acts 19:1-8"},{"id":"responsorial-psalm","citation":"Ps 68:2-3ab, 4-5acd, 6-7ab"},{"id":"gospel","citation":"John 16:29-33"}]}