{"date":"2026-04-04","form":"1962","calendar":"mexico","season":{"code":"lent","name":{"en":"Lent","es":"Cuaresma","pt-BR":"Quaresma"},"week":null},"celebration":{"title":{"en":"Holy Saturday","es":"Sábado Santo","pt-BR":"Sábado Santo"},"rank":{"code":"class-1","name":{"en":"Sacred Triduum of the I Class","es":"Sagrado Triduo de I clase","pt-BR":"Sagrado Tríduo de I classe"}},"color":"violet"},"alternatives":[],"status":null,"readings":[{"id":"epistle","citation":"Colossians 3:1-4; 117:1","passages":[{"book":"colossians","startChapter":3,"startVerse":1,"endChapter":3,"endVerse":4},{"book":"psalms","startChapter":117,"startVerse":1,"endChapter":117,"endVerse":1}]},{"id":"gospel","citation":"Matthew 28:1-7","passages":[{"book":"matthew","startChapter":28,"startVerse":1,"endChapter":28,"endVerse":7}]}]}