{"date":"2026-09-03","form":"ordinary","calendar":"brazil","season":{"code":"ordinary-time","name":{"en":"Ordinary Time","es":"Tiempo Ordinario","pt-BR":"Tempo Comum"},"week":22},"celebration":{"title":{"en":"Saint Gregory the Great, pope and doctor of the Church","es":"San Gregorio Magno, papa y doctor de la Iglesia","pt-BR":"São Gregorio Magno, papa e doutor da Igreja"},"rank":{"code":"memorial","name":{"en":"Memorial","es":"Memoria","pt-BR":"Memória"}},"color":"white"},"alternatives":[],"status":null,"readings":[{"id":"first-reading","citation":"1 Cor 3:18-23"},{"id":"responsorial-psalm","citation":"Ps 24:1bc-2, 3-4ab, 5-6"},{"id":"gospel","citation":"Luke 5:1-11"}]}