{"date":"2027-04-13","form":"1962","calendar":"mexico","season":{"code":"easter","name":{"en":"Paschaltide","es":"Tiempo Pascual","pt-BR":"Tempo Pascal"},"week":null},"celebration":{"title":{"en":"St. Hermenegild, Martyr","es":"San Hermenegildo, mártir","pt-BR":"Santo Hermenegildo, mártir"},"rank":{"code":"class-3","name":{"en":"Feast of the III Class","es":"Fiesta de III clase","pt-BR":"Festa de III classe"}},"color":"red"},"alternatives":[{"title":{"en":"Feria of the 3rd Week of Easter","es":"Feria de la 3.ª semana de Pascua","pt-BR":"Féria da 3ª semana da Páscoa"},"rank":{"code":"commemoration","name":{"en":"Commemoration","es":"Conmemoración","pt-BR":"Comemoração"}},"color":null}],"status":null,"readings":[{"id":"epistle","citation":"Wisdom 10:10-14","passages":[{"book":"wisdom","startChapter":10,"startVerse":10,"endChapter":10,"endVerse":14}]},{"id":"gospel","citation":"Luke 14:26-33","passages":[{"book":"luke","startChapter":14,"startVerse":26,"endChapter":14,"endVerse":33}]}]}