{"date":"2027-09-17","form":"ordinary","calendar":"united-states","season":{"code":"ordinary-time","name":{"en":"Ordinary Time","es":"Tiempo Ordinario","pt-BR":"Tempo Comum"},"week":24},"celebration":{"title":{"en":"Friday of the Twenty-fourth Week in Ordinary Time","es":"Viernes de la 24.ª semana del Tiempo Ordinario","pt-BR":"Sexta-feira da 24ª semana do Tempo Comum"},"rank":{"code":"weekday","name":{"en":"Weekday","es":"Feria","pt-BR":"Féria"}},"color":"green"},"alternatives":[{"title":{"en":"Saint Hildegard of Bingen, Abbess and Doctor of the Church","es":"Santa Hildegarda de Bingen, abadesa y doctora de la Iglesia","pt-BR":"São Hildegard of Bingen, abadessa e doutor da Igreja"},"rank":{"code":"optional-memorial","name":{"en":"Optional Memorial","es":"Memoria libre","pt-BR":"Memória facultativa"}},"color":"white"},{"title":{"en":"Saint Robert Bellarmine, bishop and doctor of the Church","es":"San Roberto Belarmino, obispo y doctor de la Iglesia","pt-BR":"São Roberto Belarmino, bispo e doutor da Igreja"},"rank":{"code":"optional-memorial","name":{"en":"Optional Memorial","es":"Memoria libre","pt-BR":"Memória facultativa"}},"color":"white"}],"status":{"code":"penance","text":{"en":"Mandatory penance. Abstinence recommended.","es":"Penitencia obligatoria. Abstinencia recomendada.","pt-BR":"Penitência obrigatória. Abstinência recomendada."},"rule":{"name":"USCCB fast and abstinence norms","url":"https://www.usccb.org/prayer-and-worship/liturgical-year-and-calendar/lent/catholic-information-on-lenten-fast-and-abstinence"}},"readings":[{"id":"first-reading","citation":"1 Tim 6:2c-12"},{"id":"responsorial-psalm","citation":"Ps 49:6-7, 8-10, 17-18, 19-20"},{"id":"gospel","citation":"Luke 8:1-3"}]}