{"date":"2027-06-18","form":"1962","calendar":"general-roman","season":{"code":"after-pentecost","name":{"en":"Season after Pentecost","es":"Tiempo después de Pentecostés","pt-BR":"Tempo depois de Pentecostes"},"week":null},"celebration":{"title":{"en":"St. Ephraem the Syrian, Deacon, Confessor, Doctor","es":"San Efrén de Siria, diácono, confesor y doctor","pt-BR":"Santo Efrém da Síria, diácono, confessor e doutor"},"rank":{"code":"class-3","name":{"en":"Feast of the III Class","es":"Fiesta de III clase","pt-BR":"Festa de III classe"}},"color":"white"},"alternatives":[{"title":{"en":"Feria of the 4th Week After Pentecost","es":"Feria de la 4.ª semana después de Pentecostés","pt-BR":"Féria da 4ª semana depois de Pentecostes"},"rank":{"code":"commemoration","name":{"en":"Commemoration","es":"Conmemoración","pt-BR":"Comemoração"}},"color":null},{"title":{"en":"SS. Mark and Marcellian, Martyrs","es":"Los santos Marcos y Marceliano, mártires","pt-BR":"Santos Marcos e Marceliano, mártires"},"rank":{"code":"commemoration","name":{"en":"Commemoration","es":"Conmemoración","pt-BR":"Comemoração"}},"color":null}],"status":{"code":"abstinence-substitution-allowed","text":{"en":"Mandatory abstinence. Substitution may be allowed.","es":"Abstinencia obligatoria. Puede permitirse la sustitución.","pt-BR":"Abstinência obrigatória. A substituição pode ser permitida."},"rule":{"name":"Code of Canon Law, canons 1246-1253","url":"https://www.vatican.va/archive/cod-iuris-canonici/eng/documents/cic_lib4-cann1244-1253_en.html"}},"readings":[{"id":"epistle","citation":"2 Timothy 4:1-8","passages":[{"book":"2-timothy","startChapter":4,"startVerse":1,"endChapter":4,"endVerse":8}]},{"id":"gospel","citation":"Matthew 5:13-19","passages":[{"book":"matthew","startChapter":5,"startVerse":13,"endChapter":5,"endVerse":19}]}]}