{"date":"2026-11-07","form":"1962","calendar":"brazil","season":{"code":"after-pentecost","name":{"en":"Season after Pentecost","es":"Tiempo después de Pentecostés","pt-BR":"Tempo depois de Pentecostes"},"week":null},"celebration":{"title":{"en":"Saturday Office of Our Lady","es":"Oficio de Nuestra Señora en sábado","pt-BR":"Ofício de Nossa Senhora no sábado"},"rank":{"code":"class-4","name":{"en":"Saturday of Our Lady of the IV Class","es":"Sábado de Nuestra Señora de IV clase","pt-BR":"Sábado de Nossa Senhora de IV classe"}},"color":"white"},"alternatives":[],"status":null,"readings":[{"id":"epistle","citation":"Sirach 24:14-16","passages":[{"book":"sirach","startChapter":24,"startVerse":14,"endChapter":24,"endVerse":16}]},{"id":"gospel","citation":"Luke 11:27-28","passages":[{"book":"luke","startChapter":11,"startVerse":27,"endChapter":11,"endVerse":28}]}]}