{"date":"2027-12-24","form":"1962","calendar":"mexico","season":{"code":"advent","name":{"en":"Advent","es":"Adviento","pt-BR":"Advento"},"week":null},"celebration":{"title":{"en":"Vigil of Christmas","es":"Vigilia de Navidad","pt-BR":"Vigília do Natal"},"rank":{"code":"class-1","name":{"en":"Vigil of the I Class","es":"Vigilia de I clase","pt-BR":"Vigília de I classe"}},"color":"violet"},"alternatives":[],"status":{"code":"penance","text":{"en":"Mandatory penance. Abstinence recommended.","es":"Penitencia obligatoria. Abstinencia recomendada.","pt-BR":"Penitência obrigatória. Abstinência recomendada."},"rule":{"name":"Conferencia del Episcopado Mexicano complementary norms","url":"https://cem.org.mx/wp-content/uploads/2022/04/Normas-CEM-a-luz-del-Nuevo-CDC-2.docx.pdf"}},"readings":[{"id":"epistle","citation":"Romans 1:1-6","passages":[{"book":"romans","startChapter":1,"startVerse":1,"endChapter":1,"endVerse":6}]},{"id":"gospel","citation":"Matthew 1:18-21","passages":[{"book":"matthew","startChapter":1,"startVerse":18,"endChapter":1,"endVerse":21}]}]}