{"date":"2026-11-09","form":"ordinary","calendar":"united-states","season":{"code":"ordinary-time","name":{"en":"Ordinary Time","es":"Tiempo Ordinario","pt-BR":"Tempo Comum"},"week":32},"celebration":{"title":{"en":"The Dedication of the Lateran Basilica in Rome","es":"La Dedicación de la Basílica de Letrán","pt-BR":"Dedicação da Basílica do Latrão"},"rank":{"code":"feast","name":{"en":"Feast","es":"Fiesta","pt-BR":"Festa"}},"color":"white"},"alternatives":[],"status":null,"readings":[{"id":"first-reading","citation":"Ezek 47:1-2, 8-9, 12"},{"id":"responsorial-psalm","citation":"Ps 46:2-3, 5-6, 8-9"},{"id":"second-reading","citation":"1 Cor 3:9c-11, 16-17"},{"id":"gospel","citation":"John 2:13-22"}]}