{"date":"2026-06-27","form":"ordinary","calendar":"brazil","season":{"code":"ordinary-time","name":{"en":"Ordinary Time","es":"Tiempo Ordinario","pt-BR":"Tempo Comum"},"week":12},"celebration":{"title":{"en":"Saturday of the Twelfth Week in Ordinary Time","es":"Sábado de la 12.ª semana del Tiempo Ordinario","pt-BR":"Sábado da 12ª semana do Tempo Comum"},"rank":{"code":"weekday","name":{"en":"Weekday","es":"Feria","pt-BR":"Féria"}},"color":"green"},"alternatives":[{"title":{"en":"Saint Cyril of Alexandria, bishop and doctor of the Church","es":"San Cirilo de Alejandría, obispo y doctor de la Iglesia","pt-BR":"São Cirilo de Alexandria, bispo e doutor da Igreja"},"rank":{"code":"optional-memorial","name":{"en":"Optional Memorial","es":"Memoria libre","pt-BR":"Memória facultativa"}},"color":"white"}],"status":null,"readings":[{"id":"first-reading","citation":"Lamentations 2:2, 10-14, 18-19"},{"id":"responsorial-psalm","citation":"Ps 74:1b-2, 3-5, 6-7, 20-21"},{"id":"gospel","citation":"Matt 8:5-17"}]}